{
  "_schema_version": 1,
  "version": "1.0.0",
  "last_changed": "2026-05-25",
  "broker": "{{ events_broker | default('artemis') }}",
  "naming_convention": {
    "pattern": "{{ project_name }}.<module>.<entity>.<action>",
    "versioning_suffix": ".v<N>",
    "verb_form": "past_participle",
    "verb_form_description": "Use past participle (criado/confirmada/autorizada/recebido). Events describe a fait accompli, not a command."
  },
  "envelope": {
    "headers": [
      {
        "name": "correlationId",
        "required": true,
        "type": "uuid",
        "description": "Request correlation id (from MDC); pairs the event with the producing request and downstream logs."
      },
      {
        "name": "{{ multi_tenancy_term }}Id",
        "required": false,
        "type": "string",
        "description": "Tenant id (slug like 'emp_alpha'). May be null for global modules where is_global=true."
      },
      {
        "name": "producedAt",
        "required": true,
        "type": "ISO-8601",
        "description": "Time when the producer emitted the event (server clock, with timezone)."
      }
    ],
    "payload_fields": [
      {
        "name": "eventId",
        "required": true,
        "type": "uuid",
        "description": "Idempotency key — consumers MUST be idempotent on this id."
      },
      {
        "name": "eventType",
        "required": true,
        "type": "string",
        "description": "Mirrors the destination name (e.g. 'bosq.cadastro.cliente.criado')."
      },
      {
        "name": "eventVersion",
        "required": true,
        "type": "string",
        "description": "Semver-like, normally 'v1'."
      },
      {
        "name": "producedAt",
        "required": true,
        "type": "ISO-8601",
        "description": "Same as the header; duplicated in body for archival."
      },
      {
        "name": "producer",
        "required": true,
        "type": "{service, instance, version}",
        "description": "Identifies the emitting service instance and its version."
      },
      {
        "name": "{{ multi_tenancy_term }}Id",
        "required": false,
        "type": "string",
        "description": "Same as header. Null for global events."
      },
      {
        "name": "correlationId",
        "required": true,
        "type": "uuid",
        "description": "Same as header."
      },
      {
        "name": "causationId",
        "required": false,
        "type": "uuid",
        "description": "eventId that triggered this event (when applicable)."
      },
      {
        "name": "actor",
        "required": false,
        "type": "{usuarioId, papel}",
        "description": "Who caused the event. Optional for system-triggered events."
      },
      {
        "name": "data",
        "required": true,
        "type": "object",
        "description": "Event-specific payload — see per-event definition."
      }
    ]
  },
  "delivery": {
    "retries": 3,
    "backoff_seconds": [
      1,
      5,
      30
    ],
    "dlq_prefix": "{{ project_name }}.dlq.",
    "replay_endpoint": "POST /api/v1/admin/dlq/{queueName}/replay",
    "replay_permission": "adm.dlq.replay",
    "alert_channel": "#{{ project_name }}-incident"
  },
  "idempotency": {
    "table": "processed_events",
    "key_field": "event_id",
    "description": "Consumers persist eventId in processed_events before any side effect; retries with the same eventId are no-ops."
  },
  "outbox": {
    "required_for": "events_in_transactional_path",
    "table": "outbox_event",
    "description": "When the event publication MUST happen if and only if the database commit succeeds, write to outbox_event in the same transaction and have a separate publisher poll-and-send. Avoids ghost events on rollback."
  },
  "destination_type_rule": {
    "single_consumer": "queue",
    "multi_consumer": "topic",
    "description": "queue = one consumer (e.g. audit-service only). topic = N independent subscribers each receive their own copy."
  },
  "modules": [],
  "$comment": "Workspace ships with empty modules (D-103, Gap B). See _examples/eerripe-events.partial.json for the BOSQ-ERP event catalog. Envelope conventions + naming_convention stay framework-level above."
}
